review_text,rating,date_created
"The app keeps freezing on the payment screen. I lost my money and the support is not responding!",1,2026-07-09
"Great update! The interface looks much cleaner and the app is loading faster now.",5,2026-07-08
"Why is there no dark mode option? Please add this feature in the next update.",3,2026-07-07
"The subscription cost is way too high for a basic tool like this. Disappointed.",2,2026-07-06
"Love this platform! It is very easy to use and helps me organize my team workflows.",5,2026-07-05
"Every time I open the app, it crashes immediately. Please fix this bug.",1,2026-07-04
"The customer service team was helpful and resolved my billing issues within 10 minutes.",4,2026-07-03
